{
  "$schema": "http://json-schema.org/draft-07/schema#",
  "$id": "capability.schema.json",
  "title": "Capability",
  "description": "Schema for a capability artefact produced by the Discovery Team. A capability is a distinct area of institutional responsibility and the deployment boundary for a self-contained domain.",
  "type": "object",
  "required": ["id", "name", "description", "status", "mandate_source", "market_context", "sub_capabilities", "design_decisions"],
  "additionalProperties": false,
  "properties": {
    "id": {
      "type": "string",
      "pattern": "^CAP-[0-9]{3}$",
      "description": "Unique capability identifier in the format CAP-NNN"
    },
    "name": {
      "type": "string",
      "description": "Short human-readable name for the capability"
    },
    "description": {
      "type": "string",
      "description": "What this capability is and why the organisation must have it"
    },
    "status": {
      "type": "string",
      "enum": ["Draft", "In review", "Approved", "Baselined", "Stable", "Revised"],
      "description": "Lifecycle status of this artefact"
    },
    "mandate_source": {
      "type": "array",
      "description": "Legislation, regulation, or policy that mandates or constrains this capability",
      "items": {
        "type": "string"
      },
      "minItems": 1
    },
    "market_context": {
      "type": "object",
      "description": "Market research findings that informed the capability design — competitive landscape, regulatory horizon, build-vs-buy assessment, and revenue model",
      "required": ["competitive_landscape", "regulatory_horizon", "build_vs_buy", "revenue_model"],
      "additionalProperties": false,
      "properties": {
        "competitive_landscape": {
          "type": "object",
          "description": "Who does what in the market, what is table stakes vs differentiator, what is being unbundled or re-bundled",
          "required": ["table_stakes", "differentiators", "disruptors", "unbundling", "rebundling", "switching_drivers"],
          "additionalProperties": false,
          "properties": {
            "table_stakes": {
              "type": "array",
              "description": "Capabilities that every major player offers — minimum viable product",
              "items": { "type": "string" }
            },
            "differentiators": {
              "type": "array",
              "description": "Capabilities where leading players achieve genuine competitive advantage",
              "items": { "type": "string" }
            },
            "disruptors": {
              "type": "array",
              "description": "Technology-led or specialist entrants reshaping the market",
              "items": { "type": "string" }
            },
            "unbundling": {
              "type": "array",
              "description": "Sub-capabilities being unbundled by specialists or fintechs",
              "items": { "type": "string" }
            },
            "rebundling": {
              "type": "array",
              "description": "Sub-capabilities being re-bundled by platform players or neobanks",
              "items": { "type": "string" }
            },
            "switching_drivers": {
              "type": "array",
              "description": "Primary drivers of customer switching between providers",
              "items": { "type": "string" }
            }
          }
        },
        "regulatory_horizon": {
          "type": "object",
          "description": "Current and upcoming regulation that creates or constrains this capability",
          "required": ["current", "incoming_2_3_years", "enforcement_signals"],
          "additionalProperties": false,
          "properties": {
            "current": {
              "type": "array",
              "description": "Regulation currently in force",
              "items": { "type": "string" }
            },
            "incoming_2_3_years": {
              "type": "array",
              "description": "Regulation expected within the next 2-3 years that will reshape this capability",
              "items": { "type": "string" }
            },
            "enforcement_signals": {
              "type": "array",
              "description": "FCA/PRA enforcement actions or supervisory statements indicating regulatory focus areas",
              "items": { "type": "string" }
            }
          }
        },
        "build_vs_buy": {
          "type": "object",
          "description": "Assessment of what platform options exist and what must be built in-house",
          "required": ["platform_options", "must_build_in_house", "buy_candidates"],
          "additionalProperties": false,
          "properties": {
            "platform_options": {
              "type": "array",
              "description": "SaaS, BaaS, or platform providers that could deliver parts of this capability",
              "items": { "type": "string" }
            },
            "must_build_in_house": {
              "type": "array",
              "description": "Sub-capabilities or components that must remain in-house for regulatory or strategic reasons",
              "items": { "type": "string" }
            },
            "buy_candidates": {
              "type": "array",
              "description": "Sub-capabilities that are strong buy or partner candidates",
              "items": { "type": "string" }
            }
          }
        },
        "revenue_model": {
          "type": "object",
          "description": "Where the margin sits and how this capability is commercially sustained",
          "required": ["primary_revenue_streams", "margin_pressure", "cross_sell_hooks"],
          "additionalProperties": false,
          "properties": {
            "primary_revenue_streams": {
              "type": "array",
              "description": "Main sources of income from this capability",
              "items": { "type": "string" }
            },
            "margin_pressure": {
              "type": "array",
              "description": "Forces compressing margin in this capability",
              "items": { "type": "string" }
            },
            "cross_sell_hooks": {
              "type": "array",
              "description": "Cross-sell or upsell pathways this capability enables",
              "items": { "type": "string" }
            }
          }
        }
      }
    },
    "sub_capabilities": {
      "type": "array",
      "description": "Subdivisions of this capability, each evaluated against the promotion test",
      "items": {
        "type": "object",
        "required": ["id", "name", "description", "promotion_test"],
        "additionalProperties": false,
        "properties": {
          "id": {
            "type": "string",
            "pattern": "^CAP-[0-9]{3}\\.[0-9]{2}$",
            "description": "Sub-capability identifier in the format CAP-NNN.XX"
          },
          "name": {
            "type": "string"
          },
          "description": {
            "type": "string"
          },
          "promotion_test": {
            "type": "object",
            "description": "Four-criterion promotion test. If 3+ criteria met the sub-capability is promoted to standalone capability.",
            "required": [
              "distinct_participants",
              "separate_regulatory_framework",
              "distinct_lifecycle",
              "independent_scalability",
              "criteria_met",
              "decision",
              "market_evidence"
            ],
            "additionalProperties": false,
            "properties": {
              "distinct_participants": {
                "type": "boolean",
                "description": "Does this sub-capability involve participants not present in the parent? (e.g. specialist third parties, separate regulators)"
              },
              "separate_regulatory_framework": {
                "type": "boolean",
                "description": "Is this sub-capability governed by a distinct regulatory framework separate from the parent?"
              },
              "distinct_lifecycle": {
                "type": "boolean",
                "description": "Does this sub-capability have end-to-end phases that do not map onto the parent capability's lifecycle?"
              },
              "independent_scalability": {
                "type": "boolean",
                "description": "Does this sub-capability have demand drivers or scaling requirements that are independent of the parent?"
              },
              "criteria_met": {
                "type": "integer",
                "minimum": 0,
                "maximum": 4,
                "description": "Number of promotion criteria met (0-4). Threshold for promotion is 3."
              },
              "decision": {
                "type": "string",
                "enum": ["RETAIN", "PROMOTE"],
                "description": "RETAIN: stays inside the parent capability's deployable unit. PROMOTE: becomes an independently deployable capability."
              },
              "market_evidence": {
                "type": "string",
                "description": "Market research findings that support or challenge the promotion decision — specialist providers, distinct regulation, distinct product lifecycle, independent demand drivers"
              }
            }
          }
        }
      },
      "minItems": 1
    },
    "design_decisions": {
      "type": "array",
      "description": "Non-obvious design choices made during capability modelling with rationale and alternatives considered",
      "items": {
        "type": "object",
        "required": ["id", "decision", "rationale", "alternatives_considered", "rejected_because"],
        "additionalProperties": false,
        "properties": {
          "id": {
            "type": "string",
            "pattern": "^DD-[0-9]{3}$"
          },
          "decision": {
            "type": "string"
          },
          "rationale": {
            "type": "string"
          },
          "alternatives_considered": {
            "type": "array",
            "items": { "type": "string" }
          },
          "rejected_because": {
            "type": "string"
          }
        }
      }
    }
  }
}
