{
  "id": "CAP-005",
  "name": "Compliance & Regulatory",
  "description": "Ensures the bank operates within the law, regulatory rules, and its own conduct standards across all products, channels, and geographies. Covers financial crime prevention (KYC/AML), sanctions screening, regulatory reporting to the PRA/FCA/HMRC, conduct monitoring, data protection (UK GDPR/DPA 2018), and the governance frameworks that maintain the bank's authorisation and operating licence. Compliance is non-negotiable — failure creates criminal liability, licence revocation, and reputational damage that cannot be recovered commercially. Unlike Risk Management (which quantifies and prices risk), Compliance is binary: the bank is either within the rules or it is not.",
  "status": "Draft",
  "mandate_source": [
    "Proceeds of Crime Act 2002 (POCA) — principal anti-money laundering legislation",
    "Terrorism Act 2000 — counter-terrorist financing obligations",
    "Money Laundering, Terrorist Financing and Transfer of Funds (Information on the Payer) Regulations 2017 (MLR 2017) as amended",
    "Economic Crime (Transparency and Enforcement) Act 2022",
    "Economic Crime and Corporate Transparency Act 2023 — failure to prevent fraud offence",
    "UK Financial Sanctions legislation — OFSI (Office of Financial Sanctions Implementation) regulations",
    "Financial Services and Markets Act 2000 (FSMA) — regulatory reporting, conduct, PRA/FCA authorisation",
    "PRA Rulebook and FCA Handbook (SYSC, COBS, BCOBS, MCOB) — systems and controls, conduct of business",
    "UK General Data Protection Regulation (UK GDPR) / Data Protection Act 2018",
    "PRA Supervisory Statement SS1/21 — Operational Resilience (also a Compliance obligation post-March 2025)",
    "FCA Consumer Duty (PS22/9) — effective July 2023 for new products, July 2024 for closed products",
    "Capital Requirements Regulation (CRR) / CRD IV — Pillar 3 disclosure, COREP/FINREP regulatory reporting",
    "UK Senior Managers and Certification Regime (SM&CR) — conduct rules, fitness and propriety",
    "Payment Services Regulations 2017 (PSRs 2017) — conduct obligations for payment services",
    "Electronic Money Regulations 2011 (EMRs)",
    "FCA Market Abuse Regulation (UK MAR) — market integrity and insider dealing prohibition",
    "Digital Operational Resilience Act (DORA) — applicable to UK branches of EU firms and UK firms with EU operations"
  ],
  "market_context": {
    "competitive_landscape": {
      "table_stakes": [
        "CDD/KYC checks at onboarding — identity verification, beneficial ownership determination, PEP and sanctions screening",
        "Ongoing transaction monitoring for suspicious activity under MLR 2017",
        "Suspicious Activity Reports (SARs) submission to the National Crime Agency",
        "OFSI sanctions list screening for all counterparties and transactions",
        "Regulatory reporting: COREP capital, FINREP financial, PRA 110 liquidity, Bank of England Statistical Returns",
        "SM&CR conduct rule training and certification for all relevant persons",
        "UK GDPR privacy notices, subject access request handling, data breach notification to ICO",
        "Annual compliance monitoring plan and board compliance report"
      ],
      "differentiators": [
        "Perpetual KYC — continuous, event-triggered client review rather than periodic refresh cycles. Early adopters (HSBC, Standard Chartered via ComplyAdvantage, Encompass) show 60-80% reduction in KYC refresh costs and improved client experience at review",
        "Real-time sanctions screening with network graph analysis — Quantexa, ComplyAdvantage, and Refinitiv World-Check One offer millisecond screening with ownership chain traversal, identifying sanctions exposure through beneficial ownership networks rather than name-only matching",
        "AI-driven transaction monitoring that reduces false positive alert rates by 30-50% compared to rule-based systems (NICE Actimize, Behavox, Featurespace for AML)",
        "Consumer Duty closed-loop governance — banks with mature fair value assessments, customer outcome monitoring, and board reporting demonstrating Consumer Duty compliance as a commercial differentiator with retail clients",
        "Automated regulatory reporting via AxiomSL or Regnology — reducing manual restatement risk, enabling faster regulatory change response, supporting real-time PRA/FCA data requests"
      ],
      "disruptors": [
        "Onfido — AI-powered identity verification (document + biometric) used in digital onboarding; challenges manual KYC document review",
        "Jumio — automated identity verification and document authentication; growing in commercial banking onboarding for SME clients",
        "ComplyAdvantage — AI-driven AML data and transaction monitoring; real-time adverse media, PEP, and sanctions data with API delivery rather than quarterly list updates",
        "Refinitiv World-Check (LSEG) — the incumbent PEP and sanctions data provider; now competing with real-time API alternatives",
        "Encompass Corporation — automated corporate KYC using public registry data (Companies House, official gazette, regulatory databases); reduces manual research time for corporate onboarding by 70-90%",
        "Behavox — AI conduct surveillance and communications monitoring; challenged by UK LIBOR scandal legacy and expanding to misconduct detection beyond communications",
        "Napier AI — intelligent transaction monitoring and client risk scoring for AML; targets banks looking to move off legacy rule-based systems",
        "Accenture / Deloitte KYC utility models — managed KYC services where a third party holds the KYC record on behalf of multiple banks; reduces duplicated effort in shared client bases (primarily corporate and institutional)",
        "SWIFT KYC Registry — industry utility for correspondent banking KYC; reduces duplication for banks with large correspondent networks"
      ],
      "unbundling": [
        "KYC is being unbundled into specialist utilities — Encompass automates corporate KYC data gathering; Onfido/Jumio automate identity verification; SWIFT KYC Registry and shared KYC utilities (proposed under various FinCEN/industry consultations) suggest direction of travel toward industry-level KYC infrastructure",
        "Sanctions screening is treated as a distinct real-time service by most technology vendors — ComplyAdvantage, Refinitiv, Dow Jones Risk & Compliance all offer sanctions screening as a standalone API service separate from broader AML platforms",
        "Regulatory reporting is unbundling from core banking — AxiomSL (now Adenza, acquired by Nasdaq), Wolters Kluwer OneSumX, and Regnology offer reporting-as-a-service that sits alongside any core banking or risk system",
        "Conduct monitoring / surveillance is a specialist category — Behavox, NICE Actimize Surveillance, Relativity Trace handle communications surveillance independently of broader compliance platforms",
        "GDPR / data protection operations is emerging as a distinct function with its own tooling (OneTrust, TrustArc) — increasingly run by a dedicated Data Protection Officer function rather than embedded in Legal or Compliance"
      ],
      "rebundling": [
        "NICE Actimize bundles transaction monitoring, KYC case management, sanctions screening, and fraud detection into a single financial crime platform — dominant in Tier 1 UK banks",
        "Fiserv and Temenos are embedding compliance modules (AML, sanctions) into their core banking platforms — driving rebundling for banks that standardise on a single core",
        "Microsoft Purview and IBM OpenPages rebundle data governance, compliance management, and risk reporting into enterprise governance platforms — increasing for UK banks with strong Microsoft or IBM infrastructure footprints",
        "Wolters Kluwer OneSumX bundles regulatory reporting, ALM, liquidity, and compliance content into a unified data and reporting platform"
      ],
      "switching_drivers": [
        "MLR 2017 and evolving NCA SAR guidance increasing AML programme expectations — banks with legacy rule-based TMS facing pressure to upgrade to AI/ML-based systems or face supervisory criticism",
        "Consumer Duty (effective 2023-2024) creating new governance and monitoring requirements not supported by legacy compliance systems",
        "Economic Crime and Corporate Transparency Act 2023 failure-to-prevent fraud offence — creates new corporate liability requiring documented fraud prevention programmes; driving demand for enterprise compliance platforms",
        "FCA data strategy and machine-readable regulatory reporting ambition — regulatory direction toward digital and automated reporting formats (XBRL, ISO 20022) making legacy manual reporting unsustainable",
        "DORA applicability for EU-facing UK branches — ICT third-party risk register and incident reporting requirements not covered by legacy compliance infrastructure"
      ]
    },
    "regulatory_horizon": {
      "current": [
        "MLR 2017 (as amended) — CDD, EDD, ongoing monitoring, SAR reporting, record-keeping. HMRC and FCA as supervisory authorities for different business lines.",
        "OFSI financial sanctions — real-time screening obligation, no safe harbour for name-matching failures in ownership chains. OFSI enforcement actions increasing (£7.5m penalty against Standard Chartered 2024).",
        "Consumer Duty (PS22/9) — four outcomes (products/services, price/value, consumer understanding, consumer support). Board annual assessment obligation. FCA using supervisory data requests to assess compliance quality.",
        "FCA/PRA SM&CR — Individual conduct rules, Senior Manager conduct rules, prescribed responsibilities, duty of responsibility.",